{
  "$id": "https://open-empires-lab/match-record.schema.json",
  "$schema": "http://json-schema.org/draft-07/schema#",
  "title": "MatchRecord",
  "allOf": [{ "if": { "properties": { "version": { "const": 1 } } },
    "then": { "not": { "anyOf": [{ "required": ["mode"] }, { "required": ["populationLimit"] }, { "required": ["wonderVictory"] }] } }, "else": { "required": ["mode"] } }],
  "type": "object",
  "properties": {
    "wonderVictory": { "type": "boolean" },
    "populationLimit": { "enum": [25, 50, 75, 100, 125, 150, 175, 200, 225, 250, 300, 400, 500] },
    "mode": { "enum": ["random-map", "regicide"] },
    "version": {
      "enum": [1, 2, 3, 4, 5, 6, 7, 8, 9, 10, 11]
    },
    "seed": {
      "type": "integer"
    },
    "rulesOrigin": {
      "enum": [
        "fallback",
        "imported"
      ]
    },
    "decideIntervalSeconds": {
      "type": "number",
      "exclusiveMinimum": 0
    },
    "maxTimeSeconds": {
      "type": "number",
      "exclusiveMinimum": 0
    },
    "commands": {
      "type": "array",
      "items": {
        "type": "object",
        "properties": {
          "tick": {
            "type": "integer",
            "minimum": 0
          },
          "command": {
            "$ref": "https://open-empires-lab/command.schema.json"
          }
        },
        "required": [
          "tick",
          "command"
        ],
        "additionalProperties": false
      }
    },
    "checksums": {
      "type": "array",
      "items": {
        "type": "object",
        "properties": {
          "tick": {
            "type": "integer",
            "minimum": 1
          },
          "hash": {
            "type": "string",
            "pattern": "^[0-9a-f]{8}$"
          }
        },
        "required": [
          "tick",
          "hash"
        ],
        "additionalProperties": false
      }
    },
    "result": {
      "$ref": "https://open-empires-lab/match-result.schema.json"
    },
    "civilizations": {
      "type": "object",
      "properties": {
        "1": {
          "type": "string"
        },
        "2": {
          "type": "string"
        }
      },
      "required": [
        "1",
        "2"
      ],
      "additionalProperties": false
    },
    "map": {
      "type": "string",
      "minLength": 1
    }
  },
  "required": [
    "version",
    "seed",
    "rulesOrigin",
    "decideIntervalSeconds",
    "maxTimeSeconds",
    "commands",
    "checksums",
    "result",
    "civilizations"
  ],
  "additionalProperties": false
}
