{
  "version": 11,
  "seed": 7,
  "rulesOrigin": "fallback",
  "civilizations": { "1": "open", "2": "open" },
  "map": "black-forest",
  "mode": "random-map",
  "decideIntervalSeconds": 0.5,
  "maxTimeSeconds": 10,
  "commands": [],
  "checksums": [
    { "tick": 100, "hash": "389068e0" },
    { "tick": 200, "hash": "032f3735" }
  ],
  "result": {
    "version": 11,
    "mode": "random-map",
    "seed": 7,
    "timeSeconds": 10,
    "players": {
      "1": { "food": 200, "wood": 200, "gold": 100, "stone": 0, "population": 4,
        "entities": 5, "age": 0, "researched": [] },
      "2": { "food": 200, "wood": 200, "gold": 100, "stone": 0, "population": 4,
        "entities": 5, "age": 0, "researched": [] }
    },
    "rejectedCommands": []
  }
}
